Title,Link,Location,Cost,Date,NumericalDate,Image,Description,Likes
Estee Lauder Warehouse Sale,https://www.todocanada.ca/city/vancouver/event/estee-lauder-warehouse-sale/,Vancouver Convention Centre 999 Canada Place Vancouver,Price: Free,November 10 2022 To November 13 2022,20221110,https://www.todocanada.ca/wp-content/uploads/Estee-Lauder-Warehouse-Sale-250x165.jpg,The Estée Lauder Companies Warehouse Sale is coming to Vancouver! Get deep discounts on M.A.C Clinique Estee Lauder TooFaced Bumble &amp; Bumble Origins Glamglow and Bobbi Brown! You’ll find Cosmetics Skincare Haircare and Fragrances all at rock-bottom warehouse prices for 4 days only! You don’t want to miss this Vancouver premiere!,0
Circle Craft Christmas Market,https://www.todocanada.ca/city/vancouver/event/circle-craft-christmas-market/,Vancouver Convention Centre 1055 Canada Place Vancouver,Price: $7.50 to $15,November 9 2022 To November 13 2022,20221109,https://www.todocanada.ca/wp-content/uploads/circlecraft-250x165.jpg,The Circle Craft Christmas Market is a premier showcase of excellence in Canadian craft and design encompassing traditional contemporary one-of-kind and production works. Since 1972 the show has been a Vancouver tradition for locals and visitors alike and is Western Canada’s largest craft market featuring hundreds of craftspeople and artisans from coast-to-coast. Join us at the Vancouver Convention Centre for an experience like no other to connect with our unique craft community.,0
South African Film Festival Canada 2022,https://www.todocanada.ca/city/vancouver/event/south-african-film-festival-canada-2022/,Online Canada,Price: $10 - $135,November 4 2022 To November 14 2022,20221104,https://www.todocanada.ca/wp-content/uploads/SAFF-Virtual-250x165.png,We are excited to announce that the South African Film Festival Canada showcasing South Africa’s diverse cultures and talents and ground-breaking films will be streaming online across Canada from November 4-14 2022.,0
Beauty And The Beast Cocktail Experience: Vancouver,https://www.todocanada.ca/city/vancouver/event/beauty-and-the-beast-cocktail-experience-vancouver-2/,Vancouver Alpen Club 4875 Victoria Dr Vancouver,Price: $45.00 ,November 4 2022 To December 18 2022,20221104,https://www.todocanada.ca/wp-content/uploads/Beauty-and-the-Beast-7-250x165.jpg,An immersive cocktail adventure! Based on the Jeanne-Marie Leprince de Beaumont fairytale come along on a 90-minute journey and step into the enchanted and cursed world of Beauty &amp; The Beast. Brought to you by the interactive team behind The Alice Cocktail Experience Neverland and The Wizard’s Den.,0
Bill Reid Gallery presents Keeping the Song Alive,https://www.todocanada.ca/city/vancouver/event/bill-reid-gallery-presents-keeping-the-song-alive/,Bill Reid Gallery 639 Hornby St Vancouver,Price: $13,November 2 2022 To March 19 2023,20221102,https://www.todocanada.ca/wp-content/uploads/2.-Mrs.-Assu-Chief-Billy-Assu-and-Ida-Halpern--250x165.jpg,Bill Reid Gallery of Northwest Coast Art presents the Canadian premiere exhibition of Keeping the Song Alive from November 2 2022 to March 19 2023. Through a rich mix of traditional music and regalia contemporary art film and historical documentation Keeping the Song Alive explores the decades-long work between ethnomusicologist Dr. Ida Halpern and the late Kwakwaka’wakw Chiefs Billy Assu and Mungo Martin to document hundreds of sacred and traditional songs. Guest curated by Cheryl Kaka’solas Wadhams and co-developed with the Jewish Museum &amp; Archives of BC. Tickets and information at: billreidgallery.ca,0
Winterlust,https://www.todocanada.ca/city/vancouver/event/winterlust/,H Tasting Lounge 1601 Bayshore Drive Vancouver,Price: $200 & up,October 30 2022 To December 30 2022,20221030,https://www.todocanada.ca/wp-content/uploads/winterlust-250x165.jpg,Escape to a winter wonderland in the heart of Coal Harbour this season with Winterlust. Indulge in an unparalleled dining experience within one of four stylishly decorated geodesic domes. Snow globes are available for a maximum of six guests per dome.,0
True to Place: stímetstexw tel xéltel,https://www.todocanada.ca/city/vancouver/event/true-to-place-stmetstexw-tel-xltel/,Bill Reid Gallery of Northwest Coast Art  639 Hornby St Vancouver,Price: $13-$30,June 15 2022 To March 23 2023,20220615,https://www.todocanada.ca/wp-content/uploads/Steve-Smith_ATimeForLoveVessel-web1_1024x1024-250x165.jpg,Bill Reid Gallery of Northwest Coast Art presents the Canadian premiere exhibition of True to Place: stímetstexw tel xéltel from June 15 2022–March 19 2023. Curated by artist and muralist Xémontalót Carrielynn Victor (Stó:lō) True to Place: stímetstexw tel xéltel examines the artistic practice of 10 Northwest Coast Indigenous artists whose expanding boundaries and embracing of contemporary styles and techniques are informed by personal and collective traditions of form story and place. Tickets and information at: billreidgallery.ca,0
Xicanx: Dreamers + Changemakers / Soñadores + creadores del cambio,https://www.todocanada.ca/city/vancouver/event/xicanx-dreamers-changemakers-soadores-creadores-del-cambio/,The Museum of Anthropology 6393 NW Marine Dr Vancouver,Price: $15,May 12 2022 To January 1 2023,20220512,https://www.todocanada.ca/wp-content/uploads/Tres-Marias_La-Pachuca_©Judith-F.-Baca-copy-250x165.jpg,The Museum of Anthropology (MOA) at UBC and The Americas Research Network (ARENET) present the world premiere of Xicanx: Dreamers + Changemakers / Soñadores + creadores del cambio. The exhibition will showcase for the first time in Canada the rich traditions of 33 Xicanx artists whose art practices draw on their Mexican-American heritage and generations of activism that began as part of El Movimiento the Chicano civil rights movement of the 1960s and 1970s in the U.S. The exhibition is a celebration of the many Xicanx artists who have and continue to combine art and activism in the vital ongoing fight for social justice for all. Tickets and information at: moa.ubc.ca,0
Chinatown Walk Talk & Dim Sum,https://www.todocanada.ca/city/vancouver/event/chinatown-walk-talk-dim-sum/,Chinatown Vancouver,Price: $125,March 1 2022 To December 31 2022,20220301,https://www.todocanada.ca/wp-content/uploads/9c.-DSC_0111-250x165.jpg,You will learn about tangible and intangible Chinese culture including food symbolism. You will learn about the significance of Chinatowns around the world the importance of Vancouver’s Chinatown and the value of the heritage buildings (I am the only one who can take people into the heritage buildings). I will also share dim sum stories.,0
Vancouver Behind-the-Scenes Brewery Tour,https://www.todocanada.ca/city/vancouver/event/vancouver-behind-the-scenes-brewery-tour/,901 W Cordova St Vancouver,Price: $97.29,January 15 2022 To January 9 2023,20220115,https://www.todocanada.ca/wp-content/uploads/3c-250x165.jpg,Explore Vancouver’s craft beer scene by hopping on the city’s #1 brewery tour. Visit 3 breweries in 3 hours on our Vancouver Brewery Tour. Enjoy behind-the-scenes tours at each stop and learn about the brewing process all while sampling a generous variety of craft beers. We’ll also send you home with a souvenir Vancouver Brewery Tours beer glass!,0
The Fraser Valley Winery Tour,https://www.todocanada.ca/city/vancouver/event/the-fraser-valley-winery-tour/,Canada Place 999 Canada Pl Vancouver,Price: $174.46 ,January 9 2022 To January 9 2023,20220109,https://www.todocanada.ca/wp-content/uploads/13-250x165.jpg,Visit British Columbia wine country on this 5-hour winery tour. The (Campbell/ Fraser Valley) is prime wine growing region as its in the same meridian as the Bordeaux area in France. We visit boutique wineries with a focus on quality variety and products that are not usually found in your average liquor store. Your tour consists of Four wineries with a wide range of Boutique wines.,0
A Wok Around Chinatown: Culinary and Cultural Walking Tour Led by a Chef,https://www.todocanada.ca/city/vancouver/event/a-wok-around-chinatown-culinary-and-cultural-walking-tour-led-by-a-chef/,Dr. Sun Yat-Sen Classical Chinese Garden 578 Carrall St Vancouver,Price:  $106.42 to $113.52 ,January 1 2022 To January 9 2023,20220101,https://www.todocanada.ca/wp-content/uploads/22-250x165.jpg,It’s no secret that Vancouver’s off-duty chefs love to shop for themselves and choose from the freshest local and exotic fruits vegetables seafoods and meats. Chinatown is where they go!. This is a 3.5-hour culinary and cultural walking tour of the colourful &amp; historic Vancouver Chinatown District.Our knowledgable guides will showcase a beautiful Classical Chinese Garden historic Chinatown landmarks then explore the exotic food cookware pastry tea and herbal medicine shops. A delicious dim sum lunch is also a part of this unique small-group tour.,0
Gastown Historic Walking Food Tour,https://www.todocanada.ca/city/vancouver/event/gastown-historic-walking-food-tour/,Starbucks inside Waterfront Station 601 West Cordova St Vancouver,Price: $103.95 ,January 1 2022 To December 31 2022,20220101,https://www.todocanada.ca/wp-content/uploads/49-250x165.jpg,No Description Available,0
